{
  "pid": "P00178",
  "citation": {"title": "A Novel Topology Optimization Approach using Conditional Deep Learning", "authors": "Sharad Rawat; M.-H. Herman Shen", "year": 2019, "venue": "arXiv preprint", "doi": "10.48550/arxiv.1901.04859", "arxiv_id": "1901.04859", "version_coded": "arXiv v1"},
  "access": "full_text",
  "coder": {"llm_model": "gpt-6-sol", "llm_date": "2026-09-26", "human_initials": null, "human_date": null},
  "stage": "cross_provider_pass",
  "included": {"decision": "include", "reason": "I-SPEED", "stratum": "speed", "method_family": "gan", "physics": "compliance", "dim": "2d"},
  "claim": {"primary_outcome_paraphrase": "For a 0.3 target volume fraction, a trained conditional GAN generates a design in 0.350 s versus 83.914 s for the conventional SIMP run, although the model often misses the requested volume fraction.", "key_phrase": "", "location": "Results and Discussions, Table 1; paragraph after Table 1", "quantitative": true, "claimed_speedup": 239.75, "claimed_speedup_basis": "Table 1 first row prints 83.914 s classical and 0.350 s CWGAN; 83.914/0.350 = 239.75 [derived]. The text describes order 10^2.", "direction": "outperform", "alternatives": "Table 1 gives four other volume-fraction cases; abstract says the generator is very cheap qualitatively."},
  "baseline": {"classical_method": "SIMP (Problem Statement; Dataset; Table 1)", "implementation": "MATLAB SIMP implementation (Dataset); further details not stated", "solver": "not stated", "hardware_classical": "not stated", "hardware_ml": "not stated; acknowledgments mention Ohio Supercomputer Center resources without assignment", "problem_size": "120 x 120 pixels for training and generated designs (Dataset)", "classical_iterations": "not stated", "classical_time": "83.914 s at target volume fraction 0.3; 114.635 s at 0.6; 83.613 s at 0.7; 72.318 s at 0.4; 71.461 s at 0.5 (Table 1)", "ml_time": "0.350 s at target volume fraction 0.3; 0.353 s at 0.6; 0.347 s at 0.7; 0.34070 s at 0.4; 0.339 s at 0.5 (Table 1)", "training_time": "not stated", "data_generation_cost": "3024 SIMP designs generated for training; generation time not stated (Dataset)", "quality_metric": "Visual comparison of generated and SIMP structures; requested volume fraction is examined qualitatively (Results and Discussions, Table 1)", "quality_gap": "Results and Discussions, Table 1: generated designs tend toward volume fraction 0.4 even when 0.3, 0.5, 0.6 or 0.7 is requested; numeric volume errors not stated."},
  "rules": {
    "R1": {"verdict": "fail", "marker": "R1-unmatched", "evidence": "Results and Discussions, Table 1: GAN inference is timed against full SIMP while generated designs often collapse near 0.4 volume fraction rather than the requested 0.3-0.7; no matched-quality timing."},
    "R2": {"verdict": "pass", "marker": "R2-none-established", "evidence": "Problem Statement and Table 1: SIMP implementation, solver, iterations and per-method hardware are not described sufficiently to establish an R2(a)-(e) condition or a listed partial condition."},
    "R3": {"verdict": "fail", "marker": "R3-no-data-cost", "evidence": "Dataset and Table 1: 3024 classical SIMP training examples are generated, but their creation time, GAN training time and break-even use count are absent from the speed comparison."},
    "R4": {"verdict": "fail", "marker": "R4-unverified-examples", "evidence": "Results and Discussions, Figures 5-6 and Table 1: comparisons show selected topology images and runtime, with admitted volume-condition failure; no FE performance evaluation of returned GAN designs is reported."}
  },
  "reporting": {"n_test_cases": "5 displayed target volume fractions in Table 1; 3024 training samples (Dataset)", "ood_test": "no", "seeds_or_variance": "no", "failure_rate_reported": "no", "timing_protocol_stated": "no", "runtimes_all_cases": "yes", "code_available": "no", "data_available": "no", "hardware_per_method_stated": "no"},
  "retest_candidate": false,
  "notes": "Authors acknowledge mode collapse and lack of a GAN evaluation metric. Table 1 is a handful of displayed cases, not a quantitative test-set quality assessment."
}
