{
  "pid": "P01960",
  "citation": {"title": "Reinforcement learning-based topology optimization for generative designed lightweight structures", "authors": "Keerthi Kumar N, Manasa C M, Pavan Kumar B K, Manish Bali", "year": 2025, "venue": "MethodsX", "doi": "10.1016/j.mex.2025.103539", "version_coded": "version of record, Europe PMC full-text XML"},
  "access": "full_text",
  "coder": {"llm_model": "gpt-6-sol", "llm_date": "2026-09-26", "human_initials": null, "human_date": null},
  "stage": "cross_provider_pass",
  "included": {"decision": "include", "reason": "I-QUALITY", "stratum": "quality", "method_family": "rl", "physics": "stress and compliance", "dim": "2d"},
  "claim": {"primary_outcome_paraphrase": "The PPO design reportedly reduces weight by as much as 40% relative to conventional SIMP and level-set approaches while retaining structural compliance.", "key_phrase": "up to 40 % weight reduction while maintaining compliance", "location": "abstract", "quantitative": true, "claimed_speedup": 8.7619, "claimed_speedup_basis": "Method validation, inference-time comparison near Fig. 12: SIMP approximately 18.4 s / PPO approximately 2.1 s = approximately 8.76.", "direction": "outperform", "alternatives": "Method validation near Fig. 12 compares approximate inference times of PPO 2.1 s and SIMP 18.4 s; the abstract also asserts rapid design-to-prototype transition."},
  "baseline": {"classical_method": "SIMP and level set named in abstract; SIMP timed in Method validation near Fig. 12", "implementation": "not stated", "solver": "not stated", "hardware_classical": "not stated", "hardware_ml": "not stated", "problem_size": "Method details, Table 1: 60 x 40 grid, 2400 elements, 2D cantilever", "classical_iterations": "not stated", "classical_time": "Method validation near Fig. 12: approximately 18.4 s for SIMP", "ml_time": "Method validation near Fig. 12: approximately 2.1 s for PPO inference", "training_time": "not stated; Method validation says 100 RL episodes with reward convergence around 70 episodes", "data_generation_cost": "not stated", "quality_metric": "Method validation, Table 5: volume fraction, maximum displacement, maximum von Mises stress, compliance; FEA after SDF smoothing described near Figs. 9 and 11", "quality_gap": "Abstract: up to 40% weight reduction relative to conventional methods; corresponding classical compliance and volume fraction not stated"},
  "rules": {"R1": {"verdict": "fail", "marker": "R1-unmatched", "evidence": "Method validation near Fig. 12: PPO and SIMP times are compared, but no matched quality, volume fraction, or evaluation budget for those timed results is shown."}, "R2": {"verdict": "pass", "marker": "R2-none-established", "evidence": "Method validation near Fig. 12 and Method details: SIMP timing is given without solver, hardware or iteration information sufficient to establish an R2 failure criterion."}, "R3": {"verdict": "fail", "marker": "R3-no-data-cost", "evidence": "Method validation near Fig. 12: an inference-time speed claim is made; neither training cost nor ToD data generation cost is quantified or amortized."}, "R4": {"verdict": "partial", "marker": "R4-FE-no-failure-rate", "evidence": "Method validation, Table 5 and text near Figs. 9 and 11: returned design is said to pass post-smoothing FEA stress and displacement checks, but rates of failed or infeasible designs are not reported."}},
  "reporting": {"n_test_cases": "Method validation, Table 5: one tabulated ToD output; wheel-hub case study near Fig. 13", "ood_test": "unclear", "seeds_or_variance": "no", "failure_rate_reported": "no", "timing_protocol_stated": "no", "runtimes_all_cases": "selective", "code_available": "no", "data_available": "on_request", "hardware_per_method_stated": "no"},
  "retest_candidate": false,
  "notes": "The abstract's numerical weight claim takes priority over the later numerical speed comparison under protocol 5.1. The article states post-smoothing FEA validation but provides no failure denominator. Source: https://www.ebi.ac.uk/europepmc/webservices/rest/PMC12355488/fullTextXML"
}
