{
  "pid": "P01016",
  "citation": {
    "title": "Designing Porous Structure with Optimized Topology using Machine Learning",
    "authors": "",
    "year": 2024,
    "venue": "Procedia CIRP",
    "doi": "10.1016/j.procir.2024.08.033",
    "arxiv_id": "",
    "version_coded": "Version of record (abstract only; publisher full text blocked by bot check)"
  },
  "access": "abstract_only",
  "coder": {"llm_model": "gpt-6-luna", "llm_date": "2026-09-26", "human_initials": null, "human_date": null},
  "stage": "cross_provider_pass",
  "included": {"decision": "include", "reason": "I-SPEED (no accessible full text)", "stratum": "none", "method_family": "other", "physics": "compliance", "dim": "unclear"},
  "claim": {"primary_outcome_paraphrase": "The abstract reports that machine learning reduces computation time while retaining performance comparable to conventional topology optimization for porous biomedical designs.", "key_phrase": "significant decrease in computation time", "location": "abstract", "quantitative": false, "claimed_speedup": null, "claimed_speedup_basis": "No numeric factor or runtimes in the accessible abstract.", "direction": "outperform", "alternatives": "The abstract frames the application as porous lightweight prosthesis and orthosis design for additive manufacturing."},
  "baseline": {"classical_method": "Conventional numerical simulation-based topology optimization (abstract)", "implementation": "not stated in accessible abstract", "solver": "not stated in accessible abstract", "hardware_classical": "not stated in accessible abstract", "hardware_ml": "not stated in accessible abstract", "problem_size": "not stated in accessible abstract", "classical_iterations": "not stated in accessible abstract", "classical_time": "not stated in accessible abstract", "ml_time": "not stated in accessible abstract", "training_time": "not stated in accessible abstract", "data_generation_cost": "not stated in accessible abstract", "quality_metric": "Optimization performance described as comparable; metric not stated in accessible abstract", "quality_gap": "not stated in accessible abstract"},
  "rules": {
    "R1": {"verdict": "na", "marker": "no-full-text", "evidence": "no full text"},
    "R2": {"verdict": "na", "marker": "no-full-text", "evidence": "no full text"},
    "R3": {"verdict": "na", "marker": "no-full-text", "evidence": "no full text"},
    "R4": {"verdict": "na", "marker": "no-full-text", "evidence": "no full text"}
  },
  "reporting": {"n_test_cases": "not stated in accessible abstract", "ood_test": "unclear", "seeds_or_variance": "unclear", "failure_rate_reported": "unclear", "timing_protocol_stated": "no", "runtimes_all_cases": "na", "code_available": "no", "data_available": "no", "hardware_per_method_stated": "no"},
  "retest_candidate": false,
  "notes": "The publisher page identifies the article as open access, but the full-text request returned HTTP 403 with an apparent bot check; no challenge was bypassed."
}

