{
  "pid": "P00597",
  "citation": {"title": "Topological dimensionality reduction-based machine learning for efficient gradient-free 3D topology optimization", "authors": "Zhaoyou Sun; Yaguang Wang; Pai Liu; Yangjun Luo", "year": 2022, "venue": "Materials & Design", "doi": "10.1016/j.matdes.2022.110885", "arxiv_id": "", "version_coded": "author-uploaded open version of record"},
  "access": "full_text",
  "coder": {"llm_model": "gpt-6-sol", "llm_date": "2026-09-26", "human_initials": null, "human_date": null},
  "stage": "cross_provider_pass",
  "included": {"decision": "include", "reason": "I-SPEED", "stratum": "speed", "method_family": "surrogate_mlp_gp", "physics": "compliance; stress; metamaterial_homogenization", "dim": "both"},
  "claim": {"primary_outcome_paraphrase": "The abstract claims that the DNN and material-field approach cuts computation time by roughly one to four orders of magnitude relative to coarse-mesh gradient-free optimization methods.", "key_phrase": "", "location": "abstract, p. 1", "quantitative": true, "claimed_speedup": 10, "claimed_speedup_basis": "Abstract, p. 1 states 1–4 orders of magnitude, equivalent to 10–10,000×; numeric field records the lower bound, not a single measured factor. §4.1, p. 9 compares 1,941 FE calls with 4,000,000 GSA and 10,243 SOLO calls on different meshes.", "direction": "outperform", "alternatives": "§4.1, p. 9: 1,941 FE analyses versus 4,000,000 for GSA and 10,243 for SOLO; §4.2, pp. 11–12: 3D compliance 1.35% and 3.23% worse than gradient-based MFSE."},
  "baseline": {"classical_method": "coarse-mesh gradient-free methods, specifically generalized simulated annealing (GSA) and SOLO (§4.1, p. 9); gradient-based MFSE used for quality (§4.1–4.2)", "implementation": "not stated", "solver": "not stated", "hardware_classical": "not stated", "hardware_ml": "not stated", "problem_size": "DNN-MFSE short cantilever: 80 × 80 elements; GSA/SOLO cited comparison: 11 × 11 elements (§4.1, p. 9); 3D cantilever: 48 × 16 × 6 and 96 × 32 × 12 elements (§4.2, pp. 11–12)", "classical_iterations": "GSA: 4 × 10^6 FE evaluations; SOLO: 10,243 FE evaluations (§4.1, p. 9)", "classical_time": "not stated", "ml_time": "not stated", "training_time": "not stated; DNN surrogate is trained within each optimization (§3, p. 8; §4.1, p. 9)", "data_generation_cost": "1,941 FE evaluations for DNN-MFSE short cantilever (§4.1, p. 9); integrated in per-problem run", "quality_metric": "compliance in Nm (§4.1, Tables 2–3, pp. 10–11; §4.2, pp. 11–12), homogenized bulk modulus (§4.3), peak weld stress in MPa (§4.4)", "quality_gap": "3D cantilever DNN-MFSE versus gradient MFSE: 4.41 versus 4.35 Nm and 3.80 versus 3.68 Nm (§4.2, pp. 11–12); short cantilever mean: 0.7564 versus 0.7472 Nm (Table 3, p. 11)"},
  "rules": {"R1": {"verdict": "fail", "marker": "R1-no-quality-comparison", "evidence": "Abstract, p. 1 and §4.1, p. 9: the speed claim compares FE counts with GSA/SOLO on 80 × 80 versus 11 × 11 meshes; no quality comparison with those speed baselines is given."}, "R2": {"verdict": "partial", "marker": "R2-inefficient-classical", "evidence": "Introduction, p. 2 calls existing density-based gradient-free methods inefficient; §4.1, p. 9 selects coarse-mesh GSA/SOLO as the speed baselines, with no solver or hardware information for a direct efficiency check."}, "R3": {"verdict": "na", "marker": "R3-per-problem-learning", "evidence": "§3 and §4.1, pp. 8–9: the surrogate is trained by Latin-hypercube samples inside each optimization, so its FE calls belong to the per-problem run rather than an offline dataset."}, "R4": {"verdict": "partial", "marker": "R4-no-failure-rate", "evidence": "§4.1–4.4, pp. 9–16: returned designs have FE-based compliance, bulk-modulus or stress results; §4.3 states volume constraints are met, but no failed-design rate is reported."}},
  "reporting": {"n_test_cases": "5 problem families: 2D cantilever, 2D MBB, 3D cantilever, 2D/3D microstructures, dropped phone (§4, pp. 8–16); several volume variants", "ood_test": "no", "seeds_or_variance": "yes", "failure_rate_reported": "no", "timing_protocol_stated": "no", "runtimes_all_cases": "no", "code_available": "no", "data_available": "on_request", "hardware_per_method_stated": "no"},
  "retest_candidate": false,
  "notes": "The abstract states a wall-clock reduction, whereas §4.1 supports it with FE-evaluation counts cited from methods using a much coarser mesh. Section 4.1 reports ten random runs and Table 3 gives compliance variance."
}
