{
  "pid": "P00786",
  "citation": {
    "title": "Multi-scale topology optimization of multi-material heterogeneous microstructures based on deep learning",
    "authors": "Jiaxiang Luo; Yu Li; Weien Zhou; Zeyu Zhang; Wen Yao",
    "year": 2025,
    "venue": "Journal of Computational Design and Engineering 12(8):127–153",
    "doi": "10.1093/jcde/qwaf064",
    "arxiv_id": "none",
    "version_coded": "publisher version (abstract only; full text unreachable)"
  },
  "access": "abstract_only",
  "coder": {
    "llm_model": "gpt-6-luna",
    "llm_date": "2026-09-26",
    "human_initials": null,
    "human_date": null
  },
  "included": {
    "decision": "include",
    "reason": "I-SPEED (no accessible full text)",
    "stratum": "none",
    "method_family": "neural_reparam",
    "physics": "metamaterial_homogenization",
    "dim": "unclear"
  },
  "claim": {
    "primary_outcome_paraphrase": "The proposed deep-learning framework is presented as substantially reducing the computational needs of multiscale, multi-material design.",
    "key_phrase": "",
    "location": "abstract",
    "quantitative": false,
    "claimed_speedup": null,
    "claimed_speedup_basis": "No factor or timings available from the accessible abstract.",
    "direction": "outperform",
    "alternatives": "The abstract also says effectiveness is demonstrated on compliance minimization and shape matching; no quantitative classical comparison is available."
  },
  "baseline": {
    "classical_method": "not stated",
    "implementation": "not stated",
    "solver": "not stated",
    "hardware_classical": "not stated",
    "hardware_ml": "not stated",
    "problem_size": "not stated",
    "classical_iterations": "not stated",
    "classical_time": "not stated",
    "ml_time": "not stated",
    "training_time": "not stated",
    "data_generation_cost": "not stated",
    "quality_metric": "not stated",
    "quality_gap": "not stated"
  },
  "rules": {
    "R1": {
      "verdict": "na",
      "marker": "no full text",
      "evidence": "no full text"
    },
    "R2": {
      "verdict": "na",
      "marker": "no full text",
      "evidence": "no full text"
    },
    "R3": {
      "verdict": "na",
      "marker": "no full text",
      "evidence": "no full text"
    },
    "R4": {
      "verdict": "na",
      "marker": "no full text",
      "evidence": "no full text"
    }
  },
  "reporting": {
    "n_test_cases": "not stated",
    "ood_test": "unclear",
    "seeds_or_variance": "unclear",
    "failure_rate_reported": "unclear",
    "timing_protocol_stated": "partial",
    "runtimes_all_cases": "na",
    "code_available": "no",
    "data_available": "no",
    "hardware_per_method_stated": "partial"
  },
  "retest_candidate": false,
  "notes": "Publisher version page returned HTTP 403. Publisher-hosted PDF was discoverable in web search but not retrievable through permitted fetch; coded abstract only.",
  "stage": "cross_provider_pass"
}