{
  "pid": "P00822",
  "citation": {"title": "Wasserstein generative adversarial networks for topology optimization", "authors": "Lucas Pereira, Larissa Driemeier", "year": 2024, "venue": "Structures 67, 106924", "doi": "10.1016/j.istruc.2024.106924", "arxiv_id": "", "version_coded": "publisher abstract only"},
  "access": "abstract_only",
  "coder": {"llm_model": "gpt-6-sol", "llm_date": "2026-09-26", "human_initials": null, "human_date": null},
  "stage": "cross_provider_pass",
  "included": {"decision": "include", "reason": "I-UNCLEAR (no accessible full text)", "stratum": "none", "method_family": "gan", "physics": "unclear", "dim": "unclear"},
  "claim": {"primary_outcome_paraphrase": "The abstract proposes WGAN prediction of optimized structures and says the resulting designs are evaluated quantitatively; it gives no direct result against a classical method.", "key_phrase": "", "location": "abstract", "quantitative": false, "claimed_speedup": null, "claimed_speedup_basis": "No speed-up figure in accessible abstract.", "direction": "similar_or_mixed", "alternatives": ""},
  "baseline": {"classical_method": "not stated", "implementation": "not stated", "solver": "not stated", "hardware_classical": "not stated", "hardware_ml": "not stated", "problem_size": "not stated", "classical_iterations": "not stated", "classical_time": "not stated", "ml_time": "not stated", "training_time": "not stated", "data_generation_cost": "not stated", "quality_metric": "not stated", "quality_gap": "not stated"},
  "rules": {"R1": {"verdict": "na", "marker": "R1-no-full-text", "evidence": "no full text"}, "R2": {"verdict": "na", "marker": "R2-no-full-text", "evidence": "no full text"}, "R3": {"verdict": "na", "marker": "R3-no-full-text", "evidence": "no full text"}, "R4": {"verdict": "na", "marker": "R4-no-full-text", "evidence": "no full text"}},
  "reporting": {"n_test_cases": "not stated", "ood_test": "unclear", "seeds_or_variance": "unclear", "failure_rate_reported": "unclear", "timing_protocol_stated": "no", "runtimes_all_cases": "na", "code_available": "yes", "data_available": "yes", "hardware_per_method_stated": "no"},
  "retest_candidate": false,
  "notes": "Publisher page requires organizational access or PDF purchase. The DOI redirect supplies only a linking page; ResearchGate offers a request form, not an open manuscript. No legitimate open full text was found. Publisher page's code-availability and replication snippets state public code and dataset, but benchmark runnability cannot be checked without the article."
}
